,Profile_Information
32,"   Contact Nilesh Barlanielspace26@gmail.comFounder @Perceptron AIwww.linkedin.com/in/nielspaceBengaluru(LinkedIn)github.com/Nielspace (Portfolio)www.kaggle.com/nielspace Summary(Portfolio)perceptronai.net (Company) I read and think a lot. And sometimes I put them in a form of apainting or a piece of music. And when I need to catch a breath I goTop Skills for a run. PythonAdobe IllustratorExperienceAdobe PhotoshopPerceptron AILanguagesFounder Hindi (Native or Bilingual)April 2020 - Present (5 months)English (Full Professional)Bengaluru, KarnatakaPerceptron Basically means ""a computer model or computerized machineCertificationsdevised to represent or simulate the ability of the brain to recognize andPython Programmingdiscriminate.""Data Science FoundationWe build models that can help you to find patterns in the most complex dataNeural Networks and Deep Learningstructure and visualise them such that it is presentable and interpretable. Creating a strong visual appeal is essential, and our Image Design servicesPublicationscan play an integral role in successfully promoting every business. From theStyle Transfer with Deep Learninginitial concept to the final product, we work hard to bring my clients’ visions toBuilding a Decision tree regressionlife.model from scratchPerceptron is not only a Data Visualisation company but also a trainingUnderstanding Gradient Descentcompany where we teach Machine Learning algorithms to understand thedata.mathsucks!???Content Creator | YoutubeMarch 2020 - Present (6 months)IndiaI create YouTube for anyone who wants to learn Artificial Intelligence andMaths, via python--a scripting language. Genesis TrainingsChief Technical Officer | Artificial Intelligence Engineer and DataScientist March 2019 - April 2020 (1 year 2 months)  Page 1 of 4   BangaloreGenesis Training is a training based start-up looking forward to equip peoplewith the knowledge and skills of AI and Deep learning along with some othertechnologies. I look after the business model of the company in terms of function and help inmaking the functional pipeline for the profitable and influential growth both interms of ethics and business. My main work is to train and coach people on technologies like ArtificialIntelligence, Deep Learning, Python, HTML, CSS, JavaScript, and Djangoand provide quality understanding for the same so that they can be thoroughlyaware of the knowledge, application and scope that these technologiesprovide. EdurekaSales ManagerDecember 2018 - March 2019 (4 months)BangaloreRubixeData ScientistMay 2018 - December 2018 (8 months)Bengaluru Area, IndiaWorking in data-science and big-data problems/projects across variousdomains. My projects includes:• Visualisations• Exploratory Analysis• Predictive Analysis using various machine-learning tools• Supervised and Unsupervised Learning • Recomendations System One of the projects that really shaped my ML skills was Stock marketanalysis and prediction. I was very much indulge about the project we Ihave undertaken and I wanted to learn more about the various techniqueswhich included Generative Adverserial Nets. Even though I wasn't able tocrack the technique behind it, I was able to solve the problem with other ML  Page 2 of 4   techniques like Fourier transforms for trend analysis, ARIMA time seriesanalysis, Heteroskedasticity, multicollinearity, serial correlation, XGBoost andLSTM. I even used PCA to look at the patterns under the hood. This project was very inspiring to me and it even showed what we cando through ML to understand and interpret the data as well to build arecommendation system for them. Mettle - NIT TrichyDesign HeadJuly 2016 - January 2017 (7 months)Tiruchchirappalli Area, IndiaMettle is annual symposium conducted by the department of Metallurgical andMaterials Engineering, NIT, Trichy.The goal was to designed: • Logo for the year 2016-2017 • Publicity brochures • Posters • Stage backdrop • Website UX• Event timelines • Magazine.The magazine design was in such a way that each topic design differed fromanother. It was fun to read and learn.Tata SteelInternMay 2016 - July 2016 (3 months)Jamshedpur Area, IndiaSummer Intern | Reducing the number of poor wind acceptance in I blastfurnaceEducationNational Institute of Technology TiruchirappalliBachelor's degree , Metallurgical and Materials engineering · (2013 - 2017)  Page 3 of 4   Karunya Residential International Mat. Hr. Sec. SchoolMaths, Physics, Chemistry, Computer science · (2011 - 2013)  Page 4 of 4"
33,"   Contact Sumeet MalikPepcoding, 3rd floor, 15 Vaishali,Above Karur Vysya Bank, Opposite Founder at Pepcoding Education Private Limited - Contributing toMetro Pillar 347, Pitampura, Delhi development of computer science skills9999258467 (Mobile)Panchkula Sub-Districtsumeet.malik@pepcoding.comwww.linkedin.com/in/sumeet-malik- Summaryab650410 (LinkedIn)pepcoding.com (Company) I founded Pecoding in Dec 2017 to work on ""Creating life-longlearners who are able to and who love to solve problems."". WeTop Skillsdream to reach a day when we deserve 16 hours / day of ourC++ students for 4 years.Business StrategyProject ManagementExperiencePepcoding Education Private LimitedFounderOctober 2017 - Present (2 years 11 months)Delhi Area, IndiaNagarroAssociate Team LeadSeptember 2012 - September 2017 (5 years 1 month)Gurgaon, IndiaAvalon Information System Pvt LtdSenior Software EngineerJanuary 2011 - September 2012 (1 year 9 months)New Delhi Area, IndiaIndus Valley PartnersSoftware EngineerJuly 2009 - December 2010 (1 year 6 months)Delhi Area, IndiaEducationPunjab Engineering CollegeBachelor of Engineering - BE, Computer Science · (2005 - 2009)  Page 1 of 1"
34,"   Contact Anisha Paulanisha78910@gmail.comMachine Learning Engineer|Aspiring to master MLwww.linkedin.com/in/Hyderabadanishapaul007 (LinkedIn)SummaryTop SkillsMachine Learning EngineerCJavaPythonExperienceCertificationsRoots Infosoft Technology Pvt LtdReaching Out of Your Comfort ZoneMachine Learning EngineerMarch 2018 - Present (2 years 6 months)Hyderabad Area, IndiaApplied AI CourseStudentAugust 2017 - November 2017 (4 months)Hyderabad Area, IndiaTata Consultancy ServicesJava DeveloperAugust 2016 - July 2017 (1 year)EducationNetaji Subhash Engineering College 109Bachelor of Technology - BTech, Information Technology · (2012 - 2016)  Page 1 of 1"
35,"   Contact Ravi Ranjan9891607865 (Home)raviranjan0631@gmail.com Data Scientist at Ank Aha Private Limited | GATE 2018Gurgaonwww.linkedin.com/in/raviranjan0631 (LinkedIn)SummaryTop SkillsRavi Ranjan is a Machine Learning, deep learning engineer withDeep Learning intermediate level of expertise and is currently looking for a job in theData Science relevant field.Machine LearningHe had recently got Facebook private AI scholarship from UdacityPreviously , he has worked as a full stack javascript web developerLanguagesat Mintware Ventures. In his free time , he likes to follow his habitEnglish (Limited Working) of reading and more about technology. He is very passionateHindi (Native or Bilingual)about Web Development and always strives to better himself as adeveloper, and the development community as a whole.Honors-AwardsCodeHuntApp Development ExperienceCounter StrikeAnk Aha Private LimitedData ScientistJanuary 2020 - Present (8 months)New Delhi Area, IndiaRMgXData Science InternJune 2019 - October 2019 (5 months)Gurgaon, IndiaFacebook Developer Circle: Delhi-NCRDeep Learning FacilitatorJune 2019 - August 2019 (3 months)Delhi Area, IndiaHave to mentor peoples in the field of Deep Learning and also monitor theirgrowth.Have attended various meetups as a facilitatorBuzSpeedConsultantNovember 2018 - May 2019 (7 months)New Delhi Area, India  Page 1 of 2   Deep Learning Consultant at Buzspeed.comBuilt an AI model for Face Recognition by using Custom Neural NetworkArchitecture Helped BuzSpeed in creating various small web apps in Node jsPerformed various client meeting with Buzspeed and Cracked lot of clientsdealsMintware Ventures Pvt. Ltd.Full-stack Developer InternJune 2018 - August 2018 (3 months)Noida Area, IndiaTalkrrrDeveloped a webapp using node, angular, ibm watson, aanyang, mongo,loopback to make the website talkative like apple siri and performed varioustask on certain commandsUsers were able to run their custom scripts and even they can set theircommands tooIt switches internally to use browser inbuilt speech api to save the use of IbmWatson resulting less to pay Learned ionic for the hybrid development to built app for both platform ios andandroidEducationGREATER NOIDA COLLEGE OF TECHNOLOGY,GAUTAMBUDDH NAGARBachelor of Technology - BTech, Computer Science · (2014 - 2018)Kendriya VidyalayaComputer Science · (2011 - 2013)  Page 2 of 2"
36,"   Contact Priyanshu Kumark2priyanshu@gmail.comUdacity Facebook Scholar '19, Data Science Enthusiast, Pythonwww.linkedin.com/in/priyanshu-kr Lover(LinkedIn)Noidawww.darkshift.co (Personal)SummaryTop SkillsPython A born-and-raised Indian boy with nothing more than passion, aHTML laptop and a dream, having a keen interest in Astronomy but notGit more than Data Science...An optimistic guy who believes,""A  QUICK  JUMP  OUT OF  THE  BOX  IS  MORE  INSIGHTFULTHAN  A  LIFETIME  OF  STANDARD  THINKING !!! ""EducationNoida Institute of Engineering & TechnologyBTech - Bachelor of Technology, Computer Science · (2017 - 2021)Roots international school · (2011 - 2017)  Page 1 of 1"
37,"   Contact Ashutosh HathidaraGurgaon, Haryana8320758513 (Mobile) Data Scientist+Full Stack Developer | Associate AI Engineer |ashutoshhathidara98@gmail.c Community Influencer | Opensource contributor | #mlfyworldomKurnoolwww.linkedin.com/in/ashutosh-hathidara-88710b138 (LinkedIn) Summarygithub.com/ashutosh1919(Personal) A passionate individual who always thrive to work on end to endashutosh1919.github.io/products which develop sustainable and scalable social andportfolio_website/dist/index.html(Portfolio) technical systems to create impact.ashutoshhathidara.wordpress.com/(Blog)My name describes my qualities,A: Active LearnerTop SkillsS: SociableMachine LearningH: Hard workingAndroid DevelopmentU: Ultra-preciseDeep LearningT: TrustworthyO: Open minded to create new thingsLanguagesS: SupportiveEnglish (Limited Working)H: HumbleHindi (Native or Bilingual)Gujarati (Native or Bilingual)What do you do ? I am Computer Science Engineer, Open source contributor andCertificationsCommunity Influencer. I love building end-to-end AI projects. IUnderstanding and Visualizing Dataam associated with a few open source communities. I influencewith PythonConvolutional Neural Networks ordinary people and small local businesses to include AI & ML inFeature Engineering their products.Launching into Machine LearningIntroduction to TensorFlow for What projects have you worked on?Artificial Intelligence, MachineI have worked on vast variety of ML models from forecastingLearning, and Deep Learningfreight rates through statistical quantitative modelling to Faceinterpolation using modified StyleGAN. Not just building projects,Honors-AwardsI have experience of deploying models to almost every cloudTop Academics infrastructure (GCP, AWS, Azure) for real time use. Moreover,Appathone Competition WinnerI am a full stack developer and UI/UX designer. I have createdSmart India Hackathon 2019 Finalistdesign templates and functionality using Adobe XD and Figma. I candevelop websites using React-Redux, Mongo DB and Node JS. How can I believe that you are good at what you do?  Page 1 of 4   In Sept. 2019, I was invited to Google Machine Learning Summitat Google Hyderabad for my exceptional interest in AI. Also, I wasselected as one of 120 Google Explore ML Facilitators from India tospread awareness about AI in students.In May 2019, I was selected as Microsoft Student Partner to teachstudents about Cloud Infrastructure and to demonstrate deploymentsof applications and ML models on Azure. In July 2019, I became Mozilla Campus Captain. With this, I startedan open source community in the college to build open sourceprojects. Under this program, I have also organised a hackathon incampus.In Sept. 2018, I designed application architecture for a startupnamed Muffito. I was also managing the complete applicationdevelopment process. What do you do other than building AI systems?I write blogs about powerful lessons in personal changes. You canvisit my blog site at ashutoshhathidara.wordpress.com . I am a public speaker and a member of AMP (Association of MuslimProfession). We work for educating students to deal with very basicbut important problems which eventually build their character.I design, build and deploy beautiful websites. Whenever I am free, Iam used to create designs in Figma.If you want to know more see my website ashutoshhathidara.com ,Please feel free to reach me at ashutoshhathidara98@gmail.com ExperienceLegato Health TechnologiesAssociate Artificial Intelligence EngineerMay 2020 - Present (4 months)Hyderabad, TelanganaWorking on core AI products to simplify healthcare system at scale. Workingon predicting recurrence and survival of cancer in human body.MicrosoftMicrosoft Student PartnerAugust 2019 - May 2020 (10 months)Hyderabad Area, India  Page 2 of 4   I was a representative to spread awareness and importance of Cloudapplications and usage of cloud among student community.GoogleExplore Machine Learning FacilitatorJune 2019 - April 2020 (11 months)Hyderābād Area, IndiaExplore Machine Learning (ML) is a Google-sponsored program for universitystudents to get started with Machine Learning. The curriculum offers 3 tracksof ML Content (Beginner, Intermediate, Advanced) and relies on universitystudent facilitators to train other students on campus and to build opensourceprojects under this program.DelhiveryApplied Data Science Research InternMay 2019 - September 2019 (5 months)Gurgaon, India- Working on pricing prediction and forecasting model for each possible originand destination pair. - Working on the explanatory model which can impact daily business profit anddensity distribution of the daily shipments.Smart India Hackathon 2019Deep Learning Developer & Team LeaderJanuary 2019 - March 2019 (3 months)IIT Roorkee- We were selected for the grand finale of the Smart India Hackathon, whichwas held on 2nd & 3rd March, 2019 at IIT Roorkee.- We were developing the prototype software for solving the complex categoryproblem - Customer automated ticket generation system. The problem wasprovided by the company named KG InfoSystem Pvt. Ltd.- We have used multiple Machine Learning & Deep Learning Algorithms.- Also Developed the web portal to manually interact using Django and React. Intel IndexerData Science InternNovember 2018 - December 2018 (2 months)San Francisco Bay AreaThis is financial Solution Company.I have made Supervised Learning model for the company which can performtime series analysis on Stock price data for 32 companies. I have built LSTM  Page 3 of 4   Neural Networks Model and trained the data of 32 companies for last 2 years.This model is also used for forecasting.Muffito INC.Android & Machine Learning DeveloperMay 2018 - October 2018 (6 months)Created Complete Android Application for locating Pub, Bar and beverageshops around you.I have implemented algorithms for Face Detection, Text extraction from Image.I was involved in the management team and data analyst of the companyduring marketing and handling software development.Android App link on play store :  \href{https://play.google.com/store/apps/details?id=com.muffito1.mobileFreeCopyAndroid DeveloperNovember 2017 - December 2017 (2 months)Ahmedabad Area, IndiaFreeCopy is the Start up from Indian Institute of Management, Ahmedabad.I have changed the integration of the whole app from Google to Firebase. I learnt the efﬁcient ways of Data communications like Retroﬁt, Eventbus etc. I experienced the real time start up.  I learnt the Design thinking of UI on perspective of People. EducationIndian Institute of Information Technology Design & ManufacturingKurnoolBachelor of Technology, Computer Science & Engineering · (2016 - 2020)Aklank Public SchoolIntermediate, Mathematics · (2014 - 2016)Vividhlaxi VidyamandirSecondry and Primary Education  · (2012 - 2014)  Page 4 of 4"
38,"   Contact Venkatesh Ramaswamyvenkatesh.x.ramaswamy@gmail.com VP of Engineering at ShareChatSan Josewww.linkedin.com/in/venramx(LinkedIn)SummaryTop SkillsTechnologist at heart with a strong focus on a results-orientedCredit Cards approach, and a people person. I believe in taking care of people,Offshore Outsourcing and the projects follow. Many years of experience dealing withISO8583large off-shore teams, completely at ease with upper and executivemanagement, experience with mission-critical and time-sensitiveprojects impacting real-time payments.*Mission statements*:o Move things at light speed in organizations when things sometimesmove at a snail's pace.o Working with totally abstract ideas and shaping them into reality.o Crisp, clear and candid communication at all times.o Fail, but fail fast. Never hesitate to accept failures and learn.o Understand people and their behaviors.Specialties: Enterprise Software, Cloud Computing, Off-shoredevelopment, 4+1 architecture views, Domain Object Models(DOMs), Multi-threaded/processing architectures, Language-agnostic software design, Process and Enterprise monitoring, ISO8583, external vendor integrations, Real-time payments (ACH, CreditCard, Debit Card) processing and settlements, FP&A and paymentsreconciliation, Merchant Risk architecture, Customer resolutions/Dispute arbitration, Large data/volume integrations via ETLExperienceShareChatVP of EngineeringApril 2019 - Present (1 year 5 months)Bengaluru, India; San Francisco, USAPeople, Engineering and everything in between.eBay  Page 1 of 4   Director Of EngineeringMarch 2018 - April 2019 (1 year 2 months)San Jose, CAeBay Marketplaces6 yearsSenior Engineering ManagerFebruary 2015 - February 2018 (3 years 1 month)San Francisco Bay AreaFocusing on People, Code and Process. (in that order).Agility of a startup in an enterprise company.Engineering Manager 2March 2012 - March 2015 (3 years 1 month)- Back end integration services for 1 year.- Back end integration and payment services for 1 year.- Back end integration, payments and loyalty related services for 1 year.eBayQuality Engineering ManagerFebruary 2011 - February 2012 (1 year 1 month)-All front-end and back-end integration services.PayPal4 years 4 monthsStaff Software EngineerMarch 2009 - February 2011 (2 years)o Architect-ed, designed, co-developed, delivered and supported a MerchantRisk platform that saved PayPal ~3 bps loss savings over the year (~$20M  atthat time). o From a design concept to production in rapid time, leading a brand new teamin Scottsdale, AZ which also included a new vendor integration.o Worked extensively with the ETL team to define the business logic forextractions and transformations.o Lead and designed an API integration project with eBay to allow the accessof the Resolutions platform via SOA.o This supported eBay's launch of the Resolutions platform in US and UK.o Lead a team of 9 developers to launch eBay's EU Resolutions initiative viaanother set of tightly-coupled SOA services and APIs.  Page 2 of 4   Sr. Software EngineerNovember 2006 - March 2009 (2 years 5 months)o San Jose lead for a team of developers working in Chennai.o Expert-level understanding of Debit Card processing, transaction model andreconciliation.o Master-level understanding of ACH and Credit Card processing.o Enhanced the framework to allow for processing via the STAR network.o Designed, presented and developed generic framework for vendor fileprocessing to make vendor integration seamless.o Responsible for day to day working and maintenance of various externalfacing services with First Data, STAR and other networks.o Focussed on educating, mentoring, working alongside and growing myChennai support folks.Epic Systems Corp.Team Leader, R&DJune 2003 - October 2006 (3 years 5 months)o One of the youngest managers in the company after just 2 years and one ofthe most technology-oriented group in the company.o Joined the specialized projects team to work on innovative and quick time-to-market products.o Creator of an innovate set of programming interfaces that was used bymultiple teams throughout the company and thoroughly appreciated.o This soon lead to the formulation of a full-fledged team, for which I wasappointed the manager in about 6 months.o Lead numerous projects through complete life cycles, planning, QA testcase validations, handling customer escalations, budget planning, contractualnegotiations with third parties, interactions with legal, etc. o Presented for two consecutive years at the yearly User Group Meeting infront of 300+ invitees from all over the country. o Mentored, reviewed and provided constructive feedback to my direct reports.o Traveled to numerous client sites that included some of the biggest HMOsand Hospitals to meet with the executive staff there. o Kept it ""human"".EducationIndiana University BloomingtonM.S., Computer Science · (2001 - 2003)  Page 3 of 4   Vivekanand Education Society's Institute Of TechnologyBachelors, Computer Science · (1997 - 2001)  Page 4 of 4"
39,"   Contact Suryansh Vermasuryanshalld@gmail.comData science enthusiast||Final year student at NIETwww.linkedin.com/in/suryansh-Greater Noidaverma-ba96b6165 (LinkedIn)EducationTop SkillsNoida Institute of Engineering & TechnologyC (Programming Language)Database Management System Bachelor of Technology - BTech, computer science and(DBMS)engineering · (2017 - 2021)LeadershipCertificationsData Science Orientation  Page 1 of 1"
40,"   Contact Abhishek Vijayvargiaabhishek.vijayvargia@gmail.com Data Scientist at Microsoft | Building AI Community | IIT KanpurPunewww.linkedin.com/in/avijayvargia(LinkedIn)SummaryTop SkillsInterested in real world Machine Learning and Data ScienceMachine Learning Problems. I am currently working in Text Analytic, NLP, DistributedData Science Machine Learning (Spark) and Explainable AIAlgorithmsLanguagesExperienceEnglishHindi MicrosoftData ScientistMarch 2020 - Present (6 months)CertificationsHyderabad, TelanganaMachine Learning Foundations: ACase Study Approach Windows Defender SmartScreenCluster Analysis in Data Mining Creating intelligence to detect futuristic phishing URLs. Utilizing machineManaging Data Analysis learning, deep learning, statistics, cybersecurity, and other computer science-Introduction to Big Data related techniques to improve protection for Microsoft Edge users.Building a Data Science TeamFogHorn Systems, IncHonors-Awards2 years 1 monthPerformer of the Quarter (Jan 2016 -Data Scientist - IIIMar 2016)January 2020 - March 2020 (3 months)1st Position in SoftwarePune Area, IndiaDevelopment competitionLead a team of data scientists and work industry-related problems including1st Position Myst (Quiz Competition)sensor data insights on edge (low configuration IoT device), Face recognition2nd Position in ClassByte (JavaBased Competition) with spoofing detection using a thermal camera, Acceleration prediction using2nd Position in Algo-Bunch driver's behavior in a running sports car and many IoT ML related problems.(Algorithm based Competition)Successfully deployed the solution with high performance and speed on theedge.  Data Scientist - IIMarch 2018 - January 2020 (1 year 11 months)Pune, Maharashtra, IndiaFresh Gravity Inc.Data Scientist | Senior Consultant, Data ScienceJuly 2015 - March 2018 (2 years 9 months)  Page 1 of 2   Pune Area, IndiaLead a team of Data Scientists, Data Engineers and Data Analysts. Workedwith multiple client in Manufacturing, Oil and Gas, Transportation, Shippingand Government organizations. Lead the effort of end to end delivery of datascience projects.InformaticaResearch InternMay 2014 - July 2014 (3 months)Added Decision trees, Random forest and Softmax Regression algorithms inMLP architecture (Informatica Machine Learning Platform). Plugged in weka (Machine Learning Library) to Informatica MLP architecture.Characterized performance of various classifiers and library on given dataset.Added support for Ensemble methods and Defined interfaces for Artificial DataScientist.EducationIndian Institute of Technology, KanpurMaster of Technology (M.Tech.), Computer Science · (2013 - 2015)Govt. Engg. College AjmerBachelor of Technology (B.Tech.), Computer Science · (2008 - 2012)DAV Senior Secondary SchoolSenior Secondary  · (2002 - 2008)  Page 2 of 2"
41,"   Contact Satyaarth Chhabrasatyarthchhabra18@gmail.com--www.linkedin.com/in/satyaarth-Delhichhabra-0b7ab0167 (LinkedIn)ExperienceTop SkillsWeb Development Self-employedc++ Web Developerbootstrap March 2020 - Present (6 months)Delhi, IndiaEducationNoida Institute of Engineering & TechnologyBachelor of Technology - BTech, Computer Science · (2019 - 2023)  Page 1 of 1"
