,Profile_Information
0,"   Contact Garima Luthragarimaluthra2198@gmail.comSite Reliability Engineering intern @LinkedIn | Mentor, Skillshipwww.linkedin.com/in/garima-luthra Foundation | Team Lead, Instinct(LinkedIn)DelhiTop SkillsSummaryDatabase Management System(DBMS) I am a third year undergraduate pursuing computer scienceC++ engineering at Indira Gandhi Delhi Technical University for womenWeb Development and currently working as a Site Reliability Engineering intern atLinkedIn. I am an experienced core team lead and an avid learner inHonors-Awards technology, always curious to learn new things. ScholarScholarNASA Space settlement design ExperienceContest, WinnerBest Mentor LinkedInSite Reliability Engineering internMay 2020 - July 2020 (3 months)SkillShip FoundationMentorFebruary 2020 - May 2020 (4 months)- Mentored a group of mentees in the Cod{on}fest 2020 to help and guide themin the field of competitive programming.- Taught the mentees various concepts, helped them find optimised solutionsto problems and debugged their codes. - Selected as one of the top three mentors in the program for actively helpingthe students. - Helped in creating programming contests on CodeChef. LinkedInInbassadorFebruary 2020 - March 2020 (2 months)WooTechMentee  Page 1 of 3   December 2019 - January 2020 (2 months)- Built an IMDb scrapper in python using the beautiful soup library. - Used the smtplib module to send mails to the users which contained timingsof their favourite shows. Instinct- Peer Educator's and Life skills society of IGDTUWCore Team Lead2017 - November 2019 (2 years)- Instinct- Peer Educator's Society of IGDTUW aims to help the students withinthe college to discover their passion and to mould themselves into becomingstronger individuals. - Conducted sessions and peer discussions on confidence building, publicspeaking and introspection. - Actively organised many technical sessions in the college under the WomenHacks wing. eDC IIT Delhi(Entrepreneurship Development Cell)Campus AmbassadorAugust 2018 - March 2019 (8 months)Liaised with the E-cell coordinators of IIT Delhi to promote entrepreneurship activities among the students of IGDTUW.Innerve Head coordinatorAugust 2018 - October 2018 (3 months)Rendezvous IITDCampus AmbassadorAugust 2018 - October 2018 (3 months)Synergy IgdtuwEvent management coordinatorAugust 2017 - August 2018 (1 year 1 month)TaaranganaCreative CoordinatorSeptember 2017 - February 2018 (6 months)Ryan International SchoolStudent Council minister  Page 2 of 3   March 2014 - March 2015 (1 year 1 month)EducationINDIRA GANDHI DELHI TECHNICAL UNIVERSITY FOR WOMENBachelor of Technology - BTech, Computer Science · (2017 - 2021)Ryan International School - India · (2002 - 2016)  Page 3 of 3"
1,"   Contact Sujeet Soniwww.linkedin.com/in/sujeetsoni Software Development Engineer at Amazon(LinkedIn) RaigarhTop Skills SummaryData Structures & AlgorithmsHow it works ? C/C++This question was the reason to choose Science (Mathematics)Android Developmentat School and Computer Science and Engineering at Graduation.I am eagerly wants to learn new things and technologies, alsoCertificationsto implement my technical skills to solve real life problems.While8th Project Innovation Contestmaking any solution or while working on any project if anyAutonomous Robotics (Ardubotics)technology or tools comes in my path then I always learn those toolsInnovation Head of Teamor technologies and implement them. Certificate Program in IntelligentSystemQuadcopter Workshop My hunger to learn and easily adoption of any tools and technologiesmakes me unique.Honors-AwardsProject Innovation Contest 2019 atKIIT ExperienceTechLab Event, Technorollix'19 Ardubotics(Autonomous Robotics), AmazonIIT BHU8 monthsSoftware Development EngineerPublicationsJuly 2020 - Present (2 months)IoT Based Smart Waste Bengaluru, Karnataka, IndiaManagement SystemSoftware Development Engineer InternJanuary 2020 - July 2020 (7 months)Bengaluru Area, IndiaUlti-met Technologies & Engineering Services Pvt LtdAndroid Development Intern June 2019 - July 2019 (2 months)BangaloreAndroid development, IoT, Data analyticsEducationOP Jindal University  Page 1 of 2   Bachelor of Technology - BTech, Computer Science · (2016 - 2020)St. Michael's Senior Secondary SchoolHigh School, Mathematics · (2012 - 2016)  Page 2 of 2"
2,"   Contact Saumya Singhsinghsaumyas150@gmail.comRedHat Open Source Award finalist| Google Connect Winner| SIHwww.linkedin.com/in/ Winner| Mentor @GCI @GSSoC @KOSS, IIT| GHCI Scholar‍saumya1singh (LinkedIn)New Delhisaumyasingh1.github.io/Saumya-Singh/ (Personal)medium.com/@singhsaumyas150 Summary(Blog)singhsaumyas150.wixsite.com/ Saumya Singh is a final year student [2017- 2021]. She is a fullsaumyacodes (Personal)stack android developer and a member of Google Actions DeveloperCommunity.  For her Open Source Contributions, she has beenTop Skillshonoured as finalist for RedHat's Open Source Academic AwardAndroid Development2020. She has mentored students at Google's open source eventSoftware DevelopmentGoogle Code In with Systers and Mifos organisation.Android StudioShe also guided open source enthusiasts for GSoC at KWOC'19(IIT-Kharagpur Initiative) .CertificationsWinnerSaumya has been part of Developer Advocate and Content CreatorJava for beginnersteam at AnitaB.org Open Source Community. Programming CourseShe has volunteered at Systers Organisation, GirlScript Summer OfExcellent performance CBSECode, Women Who Code - Delhi. Backend Developer InternShe has been winner & runner-up of 5+ hackathons from Smart IndiaHackathon 2019(India’s Biggest Hackathon that involves 2 Lakh+Honors-Awardsstudents) to Delhi Police Hackathon 2019.WinnerWinnerhttps://github.com/SaumyaSingh1Women In Open Source Academichttps://twitter.com/Saumya1SinghAward 2020 finalist by RedHathttps://saumyasingh1.github.io/Saumya-Singh/#Featured Mentor for Google Code Inby AnitaB organizationFeatured Mentor by AnitaBorganizationExperienceAnitaB.orgDeveloper Advocate [Open Source Teams] at AnitaB.org Open SourceMay 2020 - July 2020 (3 months)Intrepid geeksAndroid DeveloperMay 2020 - June 2020 (2 months)Google PlayLaunched Scan India App, an alternative to CamScanner   Page 1 of 4   May 2020 - May 2020 (1 month)It took 3 days to build the PDF Scanner app that scans and convert documentsinto PDFs in seconds. The app is free of ads and it generate scanned PDF inseconds.We will add more features in updated versions.Link- https://www.codersgram.com/2020/07/ScanIndia-App.htmlCoding BlocksTeaching Assistant Intern for Android Development CourseJanuary 2020 - May 2020 (5 months)New Delhi Area, IndiaPreparing Quizes, Assignments for the students and writing technical blogs onAndroid development. Involved in taking up doubts of students. GoogleGoogle Code In Mentor , 2019November 2019 - May 2020 (7 months)GirlScript Summer of Code5 monthsProject MentorFebruary 2020 - April 2020 (3 months)New Delhi Area, IndiaOrganizer's TeamDecember 2019 - April 2020 (5 months)New Delhi Area, IndiaSmart India Hackathon 2019WinnerFebruary 2019 - April 2020 (1 year 3 months)Kerala,IndiaGirlScript FoundationProject Lead InternMarch 2020 - March 2020 (1 month)New Delhi, DelhiI am been chosen as project Lead by GirlScript Foundation(https://www.girlscript.tech/) for a project whose motto is “Skill Development forSlums”.   Page 2 of 4   GirlScript along in collaboration with cry.org is aiming to make this project a bigsuccess by shaping the career of 21 scholar students of the Shahbad SLUMarea in Delhi, India.Indian Institute of Technology, KharagpurMentorDecember 2019 - January 2020 (2 months)IndiaMentored students on Software Development Project in Indian Institute ofTechnology, Kharagpur initiative for Open Source named KOSS(Kharagpuropen source society).Google DevelopersActions On Google2019 - January 2020 (1 year)I  published  A Google Action on Java Interview Quiz and that has beenapproved by Google.There are 45 short java questions (along with answers) . Try it on your phone's Google Assistant using this link : https://assistant.google.com/services/a/uid/000000b9e9002eb5?hl=en&source=webReviews will be highly appreciated. And that will help me to improve my workon Google too .SalesforceSalesforce Administrator TrainingSeptember 2019 - October 2019 (2 months)New Delhi Area, IndiaCompleted Online Training on SalesForce Platform .HackerRankPractitioner2018 - September 2019 (1 year)EazyPGAndroid DeveloperJuly 2019 - August 2019 (2 months)Delhi Technological University, New Delhi  Page 3 of 4   Worked on a project which aims to make PGs of India smart  . It is best  IndianPG app for owners and tenants. It has 1K + downloads on Playstore . #Android #FirebaseBackstage SupportersAndroid Developer at Backstage SupporterMay 2019 - June 2019 (2 months)EducationCh. Brahm Prakash Govt. Engineering CollegeBachelor of Technology - BTech, Information Technology · (2017 - 2021)Guru Gobind Singh Indraprastha UniversityBachelor of Technology - BTech, Information Technology · (2017 - 2021)Kendriya VidyalayaHigh School| 10th Class  · (2015 - 2015)  Page 4 of 4"
3,"   Contact Shrikant Singhwww.linkedin.com/in/shrikant- Retail | Amazon | ISB | IITsingh-9504402 (LinkedIn) BengaluruTop Skills SummaryData AnalysisI currently serve as Category Head- PC Business at Appario RetailBusiness Analysisand as Program Head for Appario’s B2B business across Mobiles,AnalyticsElectonics and PC businesses.  Appario Retail is a seller on AmazonIndia and is wholly owned subsidiary of a JV between Amazon andLanguagesthe Patni group. EnglishHindiI joined Amazon India in May’14 & was involved in several newlaunches on Amazon.in - Pets Supplies in Aug’14, Grocery in Oct’14,Honors-AwardsAmazon NOW in Mar’15, Amazon Pantry in May’15 and Prime NOWAmazon Cowboy Awardin June’17. MIT Summer research ScholarshipIn Jan’18, I moved to my current role at Appario.ISB Merit based ScholarshipBHP Billiton Summer ResearchScholarship Pre Amazon and MBA, I spent 3.5 years with Mu Sigma working onKarlruhe University Research data analytics projects for Fortune 500 clients out of our BangaloreScholarshipand US offices.PublicationsExploring carbon nanotubes as Experiencecatalysts in Hydrogen Fuel CellsAppario Retail Private Limited2 years 8 monthsManager, Vendor Management - Personal ComputersJuly 2018 - Present (2 years 2 months)Bengaluru Area, IndiaBusiness Head at Appario Retail - Currently leading customer shoppingexperience & internal PnL management for PC Peripherals portfolio onAmazon India :1. Printers & Ink2. Storage devices3. Laptop & Tablet Accessories4. PC Gaming 5. Networking devices6. Desktop and Laptop Components  Page 1 of 3   I am additionally responsible for launching and scaling Appario Retailoperations for all categories on Amazon's business (B2B) platform :1. Personal Computers & PC Peripherals2. Consumer Electronics ( Audio and Cameras)3. Mobiles & Mobile accessories 4. Office Products 5. Musical InstrumentsSenior Vendor Manager -Personal ComputersJanuary 2018 - June 2018 (6 months)BangalorePart of the launch and scale up team at Appario Retail. Responsibilities: To launch and manage the PnLs for categories:1. Storage2. Gaming3. PC Components4. IT Accessories.Amazon India3 years 8 monthsSenior Category Manager - Grocery, Pets Supplies & Prime NOWApril 2016 - December 2017 (1 year 9 months)Bangalore1. As part of the International Expansion team at Amazon, I am responsible formanaging customer focused inputs (selection, instock and pricing) along withthe P&L ownership for Grocery and Pets Supplies categories. 2. Also involved in new initiatives and launches under the Grocery umbrella:a. Amazon Pantry in Bangaloreb. Amazon NOW in all metros3. I am also responsible for handling special Supply Chain and Ops projectsfor intrinsically transit sensitive categories such as Grocery, Beauty, HouseholdSupplies, Baby and PetsInstock Manager - Grocery and Pets Supplies May 2014 - March 2016 (1 year 11 months)Bengaluru Area, India1. Launched India's largest online/offline Pets Supplies category, where Iwas responsible for brand engagement, inventory management, vendor  Page 2 of 3   management and seller management functions for a category with 6Xselection of its closest competition2. Launched India's largest online/offline Grocery and Gourmet Foods onAmazon India. Led inventory management and seller management functionsfor the category, which currently is operating with over 300,000 SKUs3. Member of Launch team for Amazon Now Pilot (Kirana Now) in BangaloreMu SigmaAssociate Manager - Analytics ConsultingNovember 2009 - April 2013 (3 years 6 months)Bengaluru Area, IndiaAs a data scientist, my responsibility was to engage with clients, understandtheir business objectives, analyze their business data and present structureddata driven solutions to the business problems.  Some of the prominent problem statements that I helped solve were:1. Building CRM dashboards for large B2B retailer2. Designing Attrition models for one of the largest B2C home improvementsupplies retailer3. Designing new store layouts for the largest B2C retailer in US4. Piloted a new customer retention program for one of Spain's largest banks GEConsultant, GE PlasticsJune 2009 - November 2009 (6 months)BangaloreAs a Consultant, my function was to collaborate with GE R&D scientists andtest out new eco-friendly polymers.EducationIndian School of BusinessPost Graduate Program (PGP), Operations & Marketing · (2013 - 2014)Indian Institute of Technology, KharagpurIntegrated MS, Industrial Chemistry · (2004 - 2009)  Page 3 of 3"
4,"   Contact Anurag Mishrawww.linkedin.com/in/ Co-Founder, CipherSchools | Ed-tech in Higher Educationanuragmishra7 (LinkedIn) Chandigarhcipherschools.com/ (Company)SummaryTop SkillsHi, I'm Anurag, Operations & SupplyMentioned below is the sneak peek of my journey so far,Operations ManagementHiring Manager-I dropped out of Navy, after 12thLanguagesHindi (Full Professional) -Did my engineering(from a Tier less college, indeed)English (Full Professional)-Worked with the startup Acadview, which was founded by an ex-Certifications Googler: Started my career as a subject matter expert(SME)  gotFront end web development promoted to SME Manager, and later was given a responsibility of aSupply.PublicationsGitHub -Founded a company HireScript: Which was solving the problem ofTechnophile2017 the internship. We were connecting pre-vetted people looking forinternships with the company hiring interns.-Have taught and is still teaching A.I, VR, Android app developmentand web development to the kids from std 4th to 12th-Worked as a Supply Head at upGrad (Ronnie Screwvala Venture) -Quit my job and-Co-founded: CipherSchools,where we are solving problems of undergraduate (students) andmaking them skillable enough to be able to crack into the goodcompanies for a job.PS: 24 YO, I come from a middle-class family where watching T.Vwhen you're in school age is a dangerous activity. My ears used tofocus on T.V and Dad's motorcycle sound when he wasn't around tobe able to take a decision of rushing to my study table on his arrival.I am reachable on anurag[at]cipherschools[dot]com  Page 1 of 4   ExperienceCipherSchoolsCo-FounderFebruary 2020 - Present (7 months)Connecting passionate unskilled students to skilled Industry experts to fulfilltheir career dreams.CipherSchools aims to provide quality education in the tech space by providinglive mentorship along with the industry-accepted curriculum.Join us and be part of an awesome journey of learning and make yourselfskillable by taking the live online classes right from your comfort zone, on thetechnologies like:1. Machine learning 2. Data Science3. Data Structures4. Full-stack web development (MERN stack)5. Competitive codingVisit: https://cipherschools.com/ to know moreTechnophileBloggerApril 2017 - Present (3 years 5 months)Used to push technical stuff on the page, say it coding, tech news, smallhacks, etc.Visit technophile2017.com  to explore.Camp K12Mentor2019 - Present (1 year)RemoteMentoring students for the courses :1. Artificial Intelligence2. VR development3. Android4. Web developmentupGrad.com  Page 2 of 4   1 year 1 monthSupply Head & DeliveryMay 2019 - November 2019 (7 months)Chandigarh Area, India-Headed the Supply.-Responsible from designing SOP up to successful cohort completion.-Hiring and Managing Industry Experts.-Creating and maintaining the pool of Subject Matter Experts.-Monitoring and taking actions on delivery/operation based on the feedback.-Planning, execution, looking after PnL(of Supply), sourcing, invoicinganything and everything revolving around  Supply and Delivery-Have worn multiple hats being in the team(i.e Cross-functional work)Supply ManagerNovember 2018 - November 2019 (1 year 1 month)Chandigarh Area, IndiaHiring & Managing Supply for College Business VerticalhireScriptFounderDecember 2018 - May 2019 (6 months)IndiaNot for profit organizationCurrent: Sharing the story of a Noob up till GeekFormer: Revamping the Internship-spaceCheck out the page to know what we did in such as short span of time: https://www.linkedin.com/company/hirescript/?viewAsMember=trueAcadView10 monthsSupply&OperationsMay 2018 - October 2018 (6 months)New Delhi Area, IndiaSME ManagerMarch 2018 - May 2018 (3 months)Chandīgarh Area, IndiaWorked as a Subject Matter Expert(SME) Manager and was responsible for allthe ins and outs happening at Acadview allied with SMEsSubject Matter ExpertJanuary 2018 - March 2018 (3 months)  Page 3 of 4   AcadViewSubject Matter ExpertJuly 2017 - August 2017 (2 months)onlineSubject Matter Expert of :1.Front end web2.JavaEducationKurukshetra UniversityBTech - Bachelor of Technology, Computer ScienceSaint John's AcademyIntermediate, Mathematics and Computer Science  Page 4 of 4"
5,"   Contact Sushrut Kumar Mishra7398701500 (Mobile)sushrutmishra27@gmail.com Technocrat || Final YearNoidawww.linkedin.com/in/sushrut-kumar-mishra-10293a188Summary(LinkedIn)I am a Computer Science Undergrad in my last year of engineering. Top SkillsI am a motivated and eager-to-learn student with experience inPython (Programming Language)programming technologies like Python, C, HTML5/CSS3, etc. I knowSQLDatabase technology MySQL. Currently, I am learning applicationWeb Content Writingframework Django.Apart from academics, I work as a content writer in my free time.CertificationsI have an eternal love for Traveling and Singing. I love to workFundamentals of Digital Marketingvoluntarily for social causes too.Digital Skills : Web AnalyticsIntroduction to the Internet of Thingsand Embedded SystemsExperienceDatabase Management SystemIntroduction to IOTVardhan Consulting EngineersSummer InternJune 2020 - July 2020 (2 months)YT&TWeb Content WriterJune 2019 - August 2019 (3 months)EducationNoida Institute of Engineering & TechnologyBachelor of Technology - BTech, Computer Science · (2017 - 2021)Kendriya vidyalaya Senior Secondary School  · (2015 - 2017)  Page 1 of 1"
6,"   Contact Prabakar Annadhasan9750536438 (Mobile)aprabakar476@gmail.com SDE - Flipkart | Ex - Amazon , Morgan StanleyBengaluruwww.linkedin.com/in/prabakar-annadhasan-3b1a88100 (LinkedIn)SummaryTop SkillsSolving great problems!!!C++Data StructuresAlgorithms ExperienceLanguages FlipkartSoftware Development EngineerTamil (Native or Bilingual)January 2020 - Present (8 months)English (Professional Working)Bengaluru Area, IndiaHonors-AwardsAmazonTechnical Starsoftware development EngineerHacker Bronze medalJanuary 2019 - January 2020 (1 year 1 month)Chennai Area, India- Amazon Appstore Tablets and Retail Web TeamMorgan Stanley11 monthsAssociate TechnologyAugust 2018 - December 2018 (5 months)BangaloreTech InternFebruary 2018 - August 2018 (7 months)Bengaluru Area, IndiaUnmetricSoftware TraineeSeptember 2017 - November 2017 (3 months)Chennai Area, IndiaiQube - Innovation CenterProgrammerApril 2016 - June 2017 (1 year 3 months)Coimbatore Area, India  Page 1 of 2   EducationKumaraguru college of Technologyinformation Technology, Computer Science · (2014 - 2018)  Page 2 of 2"
