,Profile_Information
7,"   Contact Kushashwa Ravi Shrimali8209956918 (Mobile)kushashwaravishrimali@gmail Software Developer (AI) at care.ai™ | Previously at NVIDIA (US),.com NTU Singapore (ROSE) | IIIT NR B.Tech CSE ('16-'20)Jaipurwww.linkedin.com/in/kushashwa-ravi-shrimali-b6780152 (LinkedIn)krshrimali.github.io (Portfolio) SummaryI'm a CSE Undergrad ('20) at IIIT NR, India. I'm currently working atTop SkillsCareAI (a healthcare startup based in Florida, US) as a SDE InternComputer Vision(AI).ResearchMachine LearningI've previously worked as a SDE (PyTorch Dev Team) intern atNVIDIA (HQ Santa Clara, US),  R&D Intern (Deep Learning) atLanguagesROSE Labs (NTU Singapore), CV & ML intern at Big Vision LLCHindiunder Dr. Satya Mallick (also wrote a few blogs on LearnOpenCV)Englishand Research Intern at IIITM Gwalior under Prof Anupam Shukla.Honors-AwardsMost of my work is open-sourced at my GitHub Profile (https://Best Ambassador of the Monthgithub.com/krshrimali). I regularly contribute to PyTorch (pleasesee: https://github.com/pytorch/pytorch/pulls/krshrimali) and havePublicationscontributed before to OpenCV (please see: https://github.com/UAV-Robot Relationship forCoordination of Robots on a opencv/opencv_contrib/pulls?q=is%3Apr+author%3Akrshrimali+isCollision Free Path %3Aclosed). I love writing efficient and impactful codes.Experiencecare.ai™Software Developer (AI)April 2020 - Present (5 months)NVIDIASoftware Engineer InternJanuary 2020 - April 2020 (4 months)Samta Clara, CaliforniaWorked as a SDE Intern in the PyTorch DL Frameworks Team at NVIDIA (HQ:Santa Clara, US). My work was mostly focused on enabling type promotionfor Unary Ops for both CUDA and CPU devices. The target was to preventextra kernel launches by doing the type promotion inside the TensorIteratorof PyTorch. The tasks also included fixing bugs in PyTorch (CUDA related),  Page 1 of 5   and adding explicit dtype argument to Unary Ops (which will help easy typepromotion for our AMP Pull Request). The work was done under mentorship of Michael Carilli (Senior SoftwareDeveloper, NVIDIA), Piotr Bialecki (Senior Software Developer, NVIDIA) andmy manager Christian Sarofeen. Most of the work was also done with the helpof awesome people at Facebook (PyTorch Team): Michael Ruberry, Natalia,Will Feng and more.The work heavily used C++, CUDA and Python (to write tests).I also contributed to PyTorch actively during my internship (and after as well).Please take a look at the PRs specific to my time at NVIDIA:1. Enabling Type Promotion: https://github.com/pytorch/pytorch/pull/333222. Adding dtype arguments to the Unary Ops for explicit type promotion:https://github.com/pytorch/pytorch/pull/330633. Fix torch.prod: https://github.com/pytorch/pytorch/pull/32831Please take a look at: https://github.com/pytorch/pytorch/pulls/krshrimali if youwant to look at my contributions to PyTorch.Rapid-Rich Object Search Lab (ROSE)Visiting ResearcherMay 2019 - July 2019 (3 months)NTU SingaporeJoined as a Visiting Researcher at ROSE Labs, NTU Singapore, undersupervision of Professor Alex Kot (Director, ROSE Labs) and Dr. Dennis Sng(Deputy Director, ROSE Labs).Worked on License Plate Detection and Recognition using YOLOv3 basednetwork. Target on detecting and recognizing characters for Double LicensePlates and on realtime dataset.Work involved multiprocessing to generate synthetic dataset for trainingcustom ALPR.Big Vision LLCComputer Vision and Machine Learning InternMarch 2018 - May 2019 (1 year 3 months)  Page 2 of 5   CaliforniaStarted working as an intern at Big Vision LLC under Dr. Satya Mallick, founderof learnopencv.com, TAAZ and Big Vision LLC.Field: Computer Vision and Machine Learning.Technical blogs written:1. Image Quality Assessment (using BRISQUE, a No-Reference Technqiue):https://www.learnopencv.com/image-quality-assessment-brisque/2. Face Averaging (Application-based): https://www.learnopencv.com/average-faces-of-fifa-world-cup-2018/3. SVM using Scikit-Learn (in Python): https://www.learnopencv.com/svm-using-scikit-learn-in-python/4. Convex Hull using OpenCV in C++ and Python: https://www.learnopencv.com/convex-hull-using-opencv-in-python-and-c/5. Code for PyTorch Image Classification (Transfer Learning) using PyTorch:https://www.learnopencv.com/image-classification-using-transfer-learning-in-pytorch/Programming Languages used: C#, C++, Python, JavaScriptIIIT-Naya RaipurSAC Science and Technology HeadNovember 2018 - March 2019 (5 months)IIIT Naya RaipurCoordinated clubs running under SAC:1. AIML (facebook.com/aiml.IIITNR/)2. TSoC (The Society of Coders)Technical Coordinator of Technical and Cultural Fest - TechNovate 2019. Technovate IIIT-NREvent CoordinatorMarch 2018 - March 2018 (1 month)  Page 3 of 5   IIIT Naya RaipurHeaded Machine Learning and Data Science event, along with Krutika Bapat(B.Tech CSE Undergraduate, IIIT Naya Raipur). SCiNTiFiC - Science ExhibitionLecturer (Volunteer)February 2018 - February 2018 (1 month)IIIT Naya RaipurGave lecture on importance of Computer Science Education, to the students ofhigh-school, of Chhattisgarh.IIIT GwaliorWinter Research Internship (Deep Learning and AI)December 2017 - January 2018 (2 months)GwaliorInternship on Multi-Agent Systems, Deep Learning Models at IIIT Gwalior,under Professor Dr. Anupam Shukla. Also focused to learn Hybrid Modelsdeveloped in the labs of IIIT Gwalior. Algorithms like A* Search, Probabilistic Distance, and Genetic were modeled,studied and learned. Project was done and implemented using Python, havingmultiple robots and multiple goals currently in a static environment, future goalbeing - for dynamic environment. OpenStudy.comAmbassadorJune 2013 - June 2017 (4 years 1 month)Newsletter Programme Leader, Designer.OpenStudy, an online educational platform for the students to get their doubtscleared, interactively. It has quite a lot users, and is now occupied by Brainly.The task, as an ambassador, was to guide the new users towards the rules,the starting steps etc. Geek WinkyTechnical Content WriterNovember 2016 - December 2016 (2 months)RaipurTechnical Content Writer.   Page 4 of 5   Blog post: http://www.geekwinky.in/2016/11/handling-linux-files-in-windows.htmlEducationInternational Institute of Information Technology Naya RaipurBachelor’s Degree, Computer Science · (2016 - 2020)Kendriya Vidayalaya STPSHigh School, CBSE - Science Stream · (2009 - 2016)  Page 5 of 5"
8,"   Contact Umang Sharmavsu556@gmail.comData Scientist at Deloitte | Author of an Upcoming Deep Learningwww.linkedin.com/in/umang- Book | Tech Speaker| Open Source Contributorsharma-datascience (LinkedIn)New Delhiumangsharma.in (Personal)SummaryTop SkillsMachine Learning Umang is a Data Scientist/Deep learning Engineer with love for DeepResearch Learning and Maths Behind Deep Learning. He is well versed withAlgorithms Probability,Statistics and Calculus.He is skilled in all aspects of data science from gathering theLanguages problem to Deep learning to deploying models in production.EnglishHindi He has worked on a number of problems in Computer Vision,Generative Modeling, NLP, Time Series, Text classification,Certifications Predictive modelling, Conversational AI platforms, ImageNeural Networks and Deep Learning classification and lightweight ML web-app and worked with all typesIntro to TensorFlow of Deep learning architectures in CNN, RNN, GANs and so on.Honors-Awards He is the author of a book on Deep Learning with TensorFlow (NotACE Award (Accenture Celebrates Python).Excellence)He is highly skilled in TensorFlow, Mxnet and other Deep learningframeworks also in GPU computing and HPC and distributedcomputing.He has a keen interest in application architectures and loves todesign and develop end-to-end solutions using multiple cloudservices like Google Cloud, AWS,AzureUmang in also skilled in multiple related components of DataScience from Data exploration, PySpark and Visualizations.In his free time he contributes to open source, speak at Techconferences,Tech events.He was an official Speaker of Google DevFest 2018 and GoogleMachine Learning crash course Pune 2018 and keynote speaker atmultiple Deep learning conferences.For detailed list of the talks he has given so far please visit :http://umangsharma.in/talks.htmlHe also got featured in Google's machine learning crash coursemagazine multiple times.**VIEWS ARE MY OWN**  Page 1 of 6   ExperienceDeloitteData Scientist/Deep Learning EngineerApril 2019 - Present (1 year 5 months)Gurgaon, IndiaThe role requires both being a hands on Deep learning Data scientist as welllead a team of Data scientists, some projects I have done so far1.Image Anomaly detection using Generative Models2.Person Pose Estimation on Live video feed using Deep learning3.Time-series forecasting using a combination of  Deep learning and statisticalalgorithms.4.Automatic video captioning using novel architectures in Deep learning 5.Image domain adaptation using Deep learning6.Distributed ML training using optimised distributed training algorithms overcluster of GPUs, CUDA,CUDNN and other parallel computing frameworks7.Entity recognition using NLP Deep learning architectures.8.End to End design of Cloud AI Application architectures using Multiple CloudPlatforms.9.High volume data science applications involving use of distributed computingsuch as PySpark.PreprintAuthorApril 2019 - Present (1 year 5 months)IndiaAuthoring of a book on Deep Learning with TensorFlow (Not in Python!) . Thebook intends to teach state of the art latest Deep learning models/algorithmsalong with end to end Deep learning Application Development, tries to explainthe calculus, probability behind the model architectures as simply as possible.The book covers CNNs, RNNs, Generative modelling, reinforcement learningand much more!Currently in Pre-PrintVarious Different Technologies  Page 2 of 6   Open Source Contributions/Personal Projects/Kaggle DataScienceCompetitions/Tech SpeakerOctober 2017 - Present (2 years 11 months)Pune Area, India• Recent Open Source Contributions:TensorFlow JS IntelliJ Plugin:Created TensorFlow JS plugin for IntelliJ and other JetBrains IDEs ,wrotelexer,parser,code Completion and AST logic for it from scratch for it inJava ,implemented Factory Design Pattern and few more design patterns.Google Datalab (A data science integrated offering by Google): 1.Made major changes in the Dockerfile of Google Datalab,which enabledIDE like features(Code Highlighting ,instance highlighting) to the Application'sJupyter notebook front-end 2.Made major changes in their python based CLI (command line interface)tools - which enabled users to see a message on application in case of issues/errors.3.Packaged Python packages to the Docker image of the application to enableautocompletion   features in the application• Algorithmic and Data Structure SolutionsI open sourced my solutions to classic algorithmic problems ongithub(Fractional Knapsack,DP Change problem and lot more)and also implementation of classic Data structures (Binary Searchtrees,heaps,LinkedLists HashMap etc)• I maintain and developed a website about me umangsharma.in.Used anumber of technologies from HTML,CSS ,JavaScript ,PHP ,Bootstrap and soon•Tech Speaker of Various national level tech events and conferences recently Ihave spoken at :Google DevFest 2017,Google Machine learning crash course2017 Pune , TensorFlow Machine learning study jam • I participate in Kaggle DataScience Competitions.In my last kaggle competition I was in world top 25% Accenture Digital AnalyticsAssociate- Machine Learning and Applications Development March 2017 - March 2019 (2 years 1 month)Pune Area, India  Page 3 of 6   I am part of the Accenture Digital's Internal Product Development Team whichis building Data Science and Analytics applications in Insurance domain .Myresponsibilities include the initial research, selecting/developing the rightmachine algorithm, developing Full stack (both UI/UX and back end)of the MLapplication and also doing the Big data computations. So far I have:- Built Regression Trees,Ridge regression(and few more ML algorithms)based Predictive analytics applications from scratch using BigData,Java,Python,BackboneJS,HighCharts JS, UnderscoreJS and PySpark,enabling clients to see both predicitive and descriptive analytics .- Built Naive Bayes algorithm based chatbots using DJango Framework andJS to enable easy interaction with users and enabling them see social mediasentiment analysis too. -Built NLP based Sentimental analysis applications using multiple NLPtechniques, Python and Data pulling APIs to classify tweets of a particulartwitter handle as positive,negative or neutral. - Have written Python Scripts to automate the Data Pre processing andAnalysis of 5 billion rows of data ,which was 20% faster than previous method.- Developed automated flows of data science from fetching to cleaning todumping on BigData to analysis of large amount of data using batchingalgorithms - Integrated 3rd Party Data visualization tools to our Analytics ML Applicationsso as to provide better analytics and descriptions to the users.- Prepared codes in multiple languages so as to automate a lot of Big dataoperations in our Big Data Environment which decrease reading operation timeby 40%.- Have written bash scripts to automate the data fetching from multiple sourcesfor fast data collections increasing speed of data collection by 50%Peepin App , Contextual Experiences Pvt LtdSolution Design EngineerSeptember 2016 - February 2017 (6 months)Gurgaon, IndiaMy responsibilities in this tech startup were:- Creating a neural network based Computer vision system, which couldclassify crowd state from a video feed as crowded, empty and mildly crowdedin C++ and Python .  Page 4 of 6   - Created a face detector application, which could take feed from low qualitycameras and could recognize people in it and their facial features in real timein C++.- Responsible for creating the whole data warehouse and data mining andanalytics system for the company, which included data from IOS, Android app,server, CRM and website- Created an IoT system to connect 100s of IoT devices together usingLinux Docker containers in a highly secure way, making the management ,maintenance and deploying codes on the devices easier ,fast and reliable- Created a neural net system to identify and increase/decrease brightness ofvideo in real timeCERN CMS Physics Center ,University of DelhiSummer Undergraduate  ResearcherJune 2015 - September 2015 (4 months)New Delhi Area, IndiaWorked on the Higgs boson Decay Channel H->ZZ->4l.Simulating the Proton Proton collisions of the Large Hadron Collider (LHC)at the centre of mass energy 14 TeV using the event generator Pythia andanalysing the data generated through CERN's data analysis framework ROOT.Also considering and generating various major reducible and irreduciblebackgrounds in the channel for my analysis (ZZ* ,ttbar etc).Wrote the code right from the scratch in the language C++ . Background process generations are used for analysing and removing thesimilar processes which are replicating the Higgs Decay Channel .Satisfactory results came in the project .Inter University Center for Astronomy and AstrophysicsSummer Research Fellow,Indian Academy of SciencesJune 2014 - August 2014 (3 months)Pune Area, IndiaWorked on a research project involving High Energy Astrophysics,ScientificComputing and Simulations.The project title was ""Monte Carlo Simulation ofradiative transfer through magnetic plasma"".I used different scientific computing tools such as GNU plot,Mathematica etcand wrote code for simulation right from the scratch in the language C++  Page 5 of 6   I also did theoretical astrophysics while collaborating with some scientists thereas a part of my project.Apart from my project work I also helped a number  of Graduate Students withtheir research problems.EducationGuru Gobind Singh Indraprastha UniversityBachelor of Technology (BTech), Information Technology · (2012 - 2016)Heera public school · (1997 - 2012)University of AllahabadJunior Diploma, Music Theory and Composition · (2007 - 2009)  Page 6 of 6"
9,"   Contact Khushi Chauhankhushichauhan425@gmail.comFront-end Developer || React js || JavaScriptwww.linkedin.com/in/khushi-Noidachauhan-764002159 (LinkedIn)SummaryTop SkillsSelf-motivated, a quick learner and an avid multitasker.. ExcellentPython (Programming Language)Web Development Time management abilities.... An enthusiastic engineer....CCertifications EducationReact JS Frontend WebNoida Institute of Engineering & TechnologyDevelopmentComputer Science · (2017 - 2021)Problem Solving (Basic) CertificateThe complete web developer in 2020Sophia girl's school meerutJavaScript12, Education · (2016 - 2017)Python (Basic) CertificateSophia girl's school meerut10, Education · (2015 - 2016)  Page 1 of 1"
10,"   Contact Ankush Dharkarwww.linkedin.com/in/ Instructor@Pesto. We're hiring for education team! Ex-Hotstar. I ❤️ankushdharkar (LinkedIn) helping people code & do better in their careers. Self-proclaimedDeveloper Advocate. ️Fairness, ️Empathy, ️Quality, ️Communityand ️Value .Top SkillsBengaluruAlgorithmsEmber.jsSummaryC++We're hiring @ Pesto! If you want to be part of helping otherLanguages developers on their learning journey, then do reach out.English (Native or Bilingual)I am passionate about building things, software and other, thatPublications improves human lives. I am interested in making money, not to beTowards Efficient Named-Entity Rule rich, but to invest it back into projects that make people happyInduction for CustomizabilityI have constant interest in learning new things, especially from ascientific backgroundI love meeting new interesting people, and working with them onvarious kind of projectsI love to volunteer in anything and everything I can contribute in, be itconducting workshops to teach someone new programming stuff, orin a local school to teach high school kids basic subjectsExperiencePesto TechInstructorJune 2020 - Present (3 months)IndiaPesto Tech is a technology education company. We train and upskill India’stop talent for fast-paced product companies across the globe and we wouldlove to be a part of your remote journey.We are NOT a learn-to-code bootcamp. Pesto trains and invests in India's topsoftware engineering talent. Pesto is not a learn-to-code Bootcamp. Our typicalstudent has a CS degree and several years of relevant work experience priorto joining Pesto.  Page 1 of 4   We test and recruit the most promising programmers from all over India.We put them through our  intense training program which includes DesignThinking, Product, Architecture, and Business Logic. We complete thepaperwork and the taxation/employee benefits part, for you. Think of us as afast track performance building accelerator, training the best and weeding outthe rest.Real Dev SquadFounder & CoachJanuary 2019 - Present (1 year 8 months)OnlineReal Dev Squad is a rag-tag team of professionals and students, learningand collaborating together to prepare themselves for the industry and stayingahead of the curveWe do a lot of things, from building useful software to staying sharp in our coreconceptsWe have an active Discord group with constant relevant activity and weeklysync-upsDo get in touch if you feel this is something you or someone you know canbenefit fromWhat will you learn:-  How to convert a conceptual requirement into a working UI-  How to structure code properly-  JS, lots of it- ️ CSS, gotta eat your veggies-  How to work with others to push out new features-  Debugging-  Better speaking and presenting tech topicsSide effect:  You willl build a demo app, that you can put on your GitHubaccount and show to people during interviews Expectations:- Commitment to getting things done- Constant updates to progress  Page 2 of 4   - ReliabilityHotstarSDE2 | SubscriptionsJanuary 2019 - March 2020 (1 year 3 months)Bengaluru Area, IndiaSoftware developer on the Hotstar’s Web engineering team, working inSubscriptions teamHotstar is one of the fastest growing video-on-demand services in the world!Launched in 2015, we broke records to become the fastest app to reach amillion downloads. Pop quiz: Which company has the world-record for 25.3million concurrent users?Our sophisticated video streaming technology and attention to detail on userexperience across multiple devices makes us the top video destination for TVShows, Movies, and LIVE SportsWith over 85,000 hours of content in 8 languages, 80 Million downloadstill date, and a rapidly exploding watch time, our mission is to revolutionizeinternet entertainment and become the largest personalized over-the-top videoservice in the worldYUDEKTechnical CofounderMay 2013 - December 2018 (5 years 8 months)Pasadena, Los Angeles, CaliforniaYUDEK is your beautiful home online that lets you hold to your links which areimportant to youSince 2015, YUDEK has been an Ember app that stays up to date with thecurrent release. YUDEK has a lot of moving parts and needs for data sync withUI, constant fetching of new data and the site is quite interactive and Emberlets us achieve those ambitious requirementsIndian Institute of Technology, BombayResearch InternDecember 2011 - July 2012 (8 months)IIT Bombay  Page 3 of 4   EducationUniversity of FloridaMaster's degree, Computer Engineering · (2012 - 2014)Shanmugha Arts, Science, Technology and Research AcademyBachelor's degree, Computer Science and Engineering · (2008 - 2012)  Page 4 of 4"
11,"   Contact Priyanka Yadavpriyankayadav14999@gmail.com Former SDE Intern @LinkedIn | GHCI'20 Scholar | CSE Undergrad,UPES | Student Mentor @YAYwww.linkedin.com/in/priyanka488Dehradun(LinkedIn)SummaryTop SkillsJava Hi, I am Priyanka, a pre-final year student at UPES, Dehradun,C++ pursuing my Bachelors in Computer Science.Android Development I love building web apps using MERN(MongoDb, Express, Reactand Node.js)  stack, and I  am currently diving deep into Cloud andCertifications Devops technologies (AWS, Docker, Kubernetes, CircleCi ).Microsoft Technology AssociateCloud and Devops Blog - https://iq.opengenus.org/author/priyanka/Github - https://github.com/Priyanka488Twitter - https://twitter.com/Priyanka__488ExperienceYAY! - Celebrating EducationStudent MentorJuly 2020 - Present (2 months)LinkedInInternMay 2020 - June 2020 (2 months)Worked for Infradev team, Production and Infrastructure Engineering.Developed a queryable middleware for infra-health apps, a Go multiproductwith GraphQL server- side runtime.Served as a data consolidation platform to communicate with variousmicroservices and datastores.Tech Stack Used : Golang, GraphQL and GraphiQLCrio.DoStudent DeveloperFebruary 2020 - April 2020 (3 months)The Launch program aimed at ""Learning by doing"". I learnt Linux Commands,OS concepts, Networking concepts, Java, Jackson, Interfaces, Code  Page 1 of 2   refactoring and real-time application of data structures and algorithms, byworking on micro-experiences like QBox, QMoney, QPrep and QCharm. OpenGenus FoundationSoftware Developer InternJuly 2019 - August 2019 (2 months)Explored and wrote articles on a wide range of topics such as introductionto MongoDB, Mongoose and web development concepts like routing andRESTful API - https://iq.opengenus.org/author/priyanka/OPEN CommunityJoint SecretaryJune 2019 - August 2019 (3 months)DehradunPromoted Open Source culture at college, and helped in organising variousworkshops and technical sessions.VerzeoMachine Learning InternMay 2018 - June 2018 (2 months)DehradunWorked on implementation of machine learning concepts using python.Developed a Hotel Booking Prediction System during the course of theinternship.Technologies: Machine Learning, Python Programming, Python(Tkinter),MongoDB using Studio3TEducationUniversity of Petroleum and Energy StudiesBachelor's degree, Computer Science - CCVT · (2017 - 2021)  Page 2 of 2"
