,Profile_Information
12,"   Contact Sanskar Jethisansyrox@gmail.comMajor League Hacking Fellow | Research Intern at IIITD |www.linkedin.com/in/sanskar123 Incoming PE Intern @Facebook | Placement Coordinator at Delhi(LinkedIn) Technological University (Formerly DCE)East DelhiTop SkillsPython (Programming Language) SummaryNode.jsI am a Senior year student at Delhi Technological University. I haveC++been a developer ever since I was 12 years of age who is an OpenSource enthusiast and a coding fanatic. I am deeply passionateLanguagesabout software development and to work with extremely talentedEnglish (Native or Bilingual)people to collaborate and make products that would make anHindi (Native or Bilingual)immediate impact. I enjoy hacking things up for any immediateproblems or projects I want to pursue. For example, I spotted anHonors-Awardsoligopoly of premium music service providers, I immediately createdFacebook F8 Scholarshipa web app to solve this issue for good. I always have a holisticOpenTechNights'19 Winnerapproach while building an app. I do not get obsessed by a singleOpenTechNights'18 Winneraspect of the app, rather I wear multiple hats until I am able to ship aproduct.PublicationsBypassing Tinder's Premium ModelMost of my personal projects always come from a problem I want tosolve, and it is by solving that problem that I grow and develop mycoding abilities. I always break down the problem into smaller piecesand work my way up using learning the necessary tools to completeit. I have excellent work ethics and I enjoy solving difficult challengesand learning from them. I served as a Teaching Assistant at Stanford University for CS108ain 2020, Google Summer of Code Intern in 2018 and a Mentorin 2020 as well. I work part-time as a Full Stack Developer atFOSSASIA and a Full Stack Mentor at Udacity. Being well versed in API architecture and security, it makes acomplete Full Stack Developer. I recently had a publication(https://apisecurity.io/issue-41-tinder-and-axway-breached-equifax-fined/)on finding a significant vulnerability in Tinder’s main API andbypassing their only premium model. I have also won variousscholarships, including the scholarship to Facebook F8 hackathonand conference. I have also given talks at various national andinternational conferences.  Page 1 of 3   ExperienceMajor League HackingMLH FellowMay 2020 - Present (4 months)• Part of the inaugural class of MLH Fellows (powered by GitHub & Facebook).• Contributed to Open Source projects written in JavaScript with a focus onReact & the React ecosystem with a team of Fellows under the educationalmentorship of a professional software engineer.• Contributed to React Native Core which is an Open Source Cross-PlatformMobile Development Framework by Facebook.Delhi Technological University (Formerly DCE)Placement CoordinatorJune 2020 - Present (3 months)Placement Coordinator for the session 2020-21.FOSSASIAFull Stack EngineerSeptember 2018 - Present (2 years)Indraprastha Institute of Information Technology, DelhiResearch Intern @ CoSy LabsMay 2020 - July 2020 (3 months)- Researched under Prof. Ganesh Baglar- Created cross-platform apps to explore the field of ComputationalGastronomy.Udacity1 yearMentor - Java DevelopmentAugust 2019 - March 2020 (8 months)Mentor - Full Stack DevelopmentApril 2019 - March 2020 (1 year)Google Summer of Code  Page 2 of 3   Full Stack Engineer | FOSSASIAApril 2018 - August 2018 (5 months)Fossasia,SingaporeEducationDelhi College of EngineeringBachelor of Technology - BTech  · (2017 - 2021)Delhi Public School - R. K. Puram · (2015 - 2017)Delhi Public School Noida · (2003 - 2015)  Page 3 of 3"
13,"   Contact Parth Anandparth4054@gmail.comAugmented Reality | EverythingXR.com | Featured Inwww.linkedin.com/in/parthanand Entrepreneur.com & DailyHunt(LinkedIn)New DelhiTop SkillsSummaryC++• I create Augmented Reality experiences for brands and companies.Microsoft Office(www.everythingxr.com)CLanguages • I teach how to create AR apps on my YouTube channel: https://www.youtube.com/c/parthanandEnglish (Full Professional)French (Elementary)• Sometimes I like to post my AR creations on LinkedIn. Have a look,Hindi (Full Professional)you will love them: https://www.linkedin.com/in/parthanand/detail/Honors-Awards recent-activity/shares/Got featured in Entrepreneur.comExperienceEverythingXRFounder2017 - Present (3 years)Consulting & Creating Augmented Reality experiences for startups &companies.LinkedInCourse InstructorFebruary 2019 - Present (1 year 7 months)Creating Augmented Reality Courses for LinkedIn Learning Platform.Independent DeveloperAugmented Reality DeveloperJune 2017 - Present (3 years 3 months)India- Freelancing as an Augmented Reality app developer for both iOS andAndroid. - Expert in both ARKit and ARCore framework for AR.-  Used tools like Unity, SceneKit, unreal engine to develop AR apps.vDoIT Technologies  Page 1 of 2   1 year 7 monthsiOS DeveloperDecember 2015 - June 2017 (1 year 7 months)Gurgaon, IndiaIntern Ios developerJune 2016 - October 2016 (5 months)Gurgaon, IndiaWorked on a social network application(Made it from scratch single handedly)intern Android developerDecember 2015 - January 2016 (2 months)Gurgaon, Indiabuilt a parking management and tracking system from scratch to uploading it togoogle play  Page 2 of 2"
14,"   Contact Gaurav ChatterjeeFLAT NO.-54, POCKET-13,PHASE-1, DWARKA, NEW DELHI Data Scientist @ Lumiq.ai | Deep Learning & Machine Learning+919480100804 (Home) Researcher | Blogger | B.Tech gold medalist& M.Tech in CSgauravchatterjee07@gmail.coNew Delhimwww.linkedin.com/in/gaurav- Summarychatterjee-857813137 (LinkedIn)gaurav-chatterjee.github.io/ Hello, Ladies and Gentlemen. First of all Thank you for reaching out(Personal)to my profile! machinelearningman.com (Blog)I am Gaurav Chatterjee, an M.Tech graduate from the CentralTop SkillsUniversity of Karnataka. Machine LearningDeep LearningAn ordinary guy who is extra enthusiastic about machine learningPythonand deep learning from the very beginning of his graduation.CertificationsI have bagged several achievements and proved that I am aNIT course certificateworthy candidate to do machine learning/ deep learning research.Learning REST APIsI have done several projects on ML and published a paper onManaging Your Personal Financescryptocurrency with the help of deep learning.Jodi Glickman on Pitching YourselfNPTEL online certificationCurrently, I am working as a Data Scientist at Lumiq.aiHonors-AwardsI am also running a blogging website named -Gold Medalist (B.TECH)machinelearningman.com to help my dear Machine Learning/ DeepFree-ship awardlearning aspirants.Certificate of Merit from Internshala.2nd Price in Geo-charades,If you are interested in hiring me for a talk/seminar/webinar OrPublications consultation for your organization, you can contact me (E-mail IDgiven in the online portfolio)  CRYPTOCURRENCY: ACOMPREHENSIVE ANALYSISHave a nice day. youtube    post      Resume     ML Blogs    Web portfolio------------------------------------------------------------ExperienceLumiq.aiData Scientist  Page 1 of 3   April 2020 - Present (5 months)Delhi, IndiaWorking as a Data Scientist at Lumiq.ai. Solving real-time problems withMachine Learning & Deep Learning.Indian Institute of Technology, DelhiAssociate ResearcherDecember 2019 - April 2020 (5 months)New Delhi, Delhi, IndiaWorked on an Autism related problem in children which is undetected whenchild is infant. Early stage detection is crucial. Detection of this problem is doneby Deep Learning.IIT HyderabadProject AssociateSeptember 2018 - December 2019 (1 year 4 months)Hyderabad, Telangana, IndiaHazardous Pothole detection using Deep Learning(YOLO). Multi Objecttracking in traffic surveillance on drone data(RetinaNet + DeepSort)National Institute of Technology, GoaMachine Learning InternMay 2018 - July 2018 (3 months)South Goa, Goa, IndiaDone a project using Recurrent neural network-LSTM. predicted the price ofBitcoin, ethereum and Litecoin using different features along with correlationcoefficient between the cryptocurrencies.Central University of KarnatakaMachine LearningFebruary 2018 - June 2018 (5 months)Gulbarga, karnarakaExamining some of the cryptocurrency like Bitcoin, Ethereum and predictingthe future rates of these cryptocurrency by training the machine in differentfileds like- past 10 year data & sentiment of social media.SIT- Symbiosis Institute of TechnologyIntern in symbiosis institute of computer studies and researchDecember 2017 - January 2018 (2 months)Pune, Maharashtra, India  Page 2 of 3   My guide Dr. B.V Dhandra and I have worked on how Big data is connectedwith Business intelligence and how hadoop aids Big dataZultanite Technologies Pvt LtdWeb Developer May 2017 - July 2017 (3 months)Sushant lok phase-1,gurgaonA hands on experience with zultanite technologies as a web developer andSeo .EducationCentral University of KarnatakaIntegrated M.Tech, Computer Science · (2018 - 2019)Central University of KarnatakaBachelor of Technology, Computer Science · (2014 - 2018)Kendriya VidyalayaIntermediate, Science · (2010 - 2014)  Page 3 of 3"
15,"   Contact Swapnil Panwalapanwala.swapnil@gmail.comMachine Learning Enthusiastwww.linkedin.com/in/swa123Surat(LinkedIn)swapn.me/mycvtemp/ (Personal)SummaryTop SkillsA Machine learning enthusiast and Deep Learning evangelist!Machine Learning Robotics and data structures are among my claims to fame. IPython regularly engage myself in hackathons and open-source projectsResearchExperienceBennett Open Source Society2 years 1 monthFounderAugust 2018 - Present (2 years 1 month)Student RepresentativeSeptember 2018 - Present (2 years)Board MemberSeptember 2018 - Present (2 years)Bennett Robotics2 years 2 monthsCore Team MemberJuly 2018 - Present (2 years 2 months)Course InstructorSeptember 2018 - November 2018 (3 months)Greater NoidaBen-Gurion University of the NegevData Mining and Business Intelligence for Cyber Security ApplicationsJuly 2019 - August 2019 (2 months)IsraelQOS TechnologyInternMay 2019 - July 2019 (3 months)New Delhi Area, India  Page 1 of 2   Times InternetData Analytics InternDecember 2018 - May 2019 (6 months)Gurgaon, IndiaLeadingIndia.aiMentorDecember 2018 - January 2019 (2 months)Bennett UniversityInternshalaSummer InternJune 2018 - August 2018 (3 months)ACM, Association for Computing Machinery1 year 1 monthEvent Managing headAugust 2017 - August 2018 (1 year 1 month)Head of Social ActivitiesAugust 2017 - August 2018 (1 year 1 month)LeadingIndia.aiInternJune 2018 - July 2018 (2 months)Greater NoidaEducationBennett UniversityBachelor of Technology, Computer Science · (2017 - 2021)Lancers Army School · (2015 - 2017)METAS Adventist College · (2005 - 2015)  Page 2 of 2"
16,"   Contact Manpreet KaurMGH, Room no. 517, Dr BRAmbedkar National Institute of Former Intern @Indian Institute of Remote sensing (ISRO) || NITtechnology, Jalandhar Jalandhar8360234032 (Mobile)Jalandharmanpreetdolly786@gmail.comwww.linkedin.com/in/manpreet- Summarykau-r (LinkedIn)Technically skilled in C, C++, Python, SQL, Data structures, WebTop Skills development, Machine learning, Spring boot and GCP.Having excellent knowledge of Operating system and DBMS andData Structures and AlgorithmsMachine Learning highly efficient in resolving complex algorithmic and logical problems.Web DevelopmentAlongside, actively contributing articles @GeeksForGeeks, which isLanguages a computer science portal for geeks.HindiEnglishExperienceCertificationsMyVintageClozetAlgorithms on GraphsSoftware EngineerIntroduction to the AWS CloudJuly 2020 - August 2020 (2 months)Algorithmic ToolboxAWS Integrated ServicesIndian Institute of Remote Sensing (IIRS), Indian Space ResearchGoogle Cloud PlatformFundamentals: Core Infrastructure Organization (ISRO)Software EngineerApril 2020 - June 2020 (3 months)Coding club NITJWeb designing HeadDecember 2018 - January 2020 (1 year 2 months)Jalandhar Area, IndiaNITJ Food festivalMarketing HeadJanuary 2019 - March 2019 (3 months)Jalandhar, Punjab, IndiaMy responsibilities include contacting companies and raising sponsorship forthe annual Food Fest, NIT-Jalandhar.Utkansh, NIT JalandharTeam Web Development,  Page 1 of 2   January 2019 - March 2019 (3 months)Jalandhar, Punjab, IndiaEducationDr B R Ambedkar National Institute of Technology, JalandharBachelor of Technology - BTech, electronics and communicationengineering · (2017 - 2021)Kendriya Vidyalaya12 CBSE, Non-medKendriya VidyalayaMatriculation   Page 2 of 2"
17,"   Contact Nikhil Singhsinghyesh2000@gmail.comStudent at Noida Institute of Engineering & Technologywww.linkedin.com/in/nikhil-Noidasingh-93236616a (LinkedIn)ExperienceTop SkillsMicrosoft Office Jio digital championMicrosoft Word VolunteerMicrosoft PowerPoint June 2018 - July 2018 (2 months)dhampurEducationNoida Institute of Engineering & TechnologyBTech - Bachelor of Technology, Computer Science · (2017 - 2021)  Page 1 of 1"
18,"   Contact Mohamed HassanKoramangala,Bangalorehassanaesthete008@gmail.com SDE at ShareChatBengaluruwww.linkedin.com/in/mohamed-hassan-b38949107 (LinkedIn)github.com/mohamedhassanmn Summary(Personal)Love to <code/>Top SkillsFront-end DevelopmentExperienceMicrosoft OfficeEngineeringShareChat9 monthsSDE-IMarch 2020 - Present (6 months)Bengaluru Area, IndiaInternDecember 2019 - February 2020 (3 months)Bengaluru Area, IndiaMasai SchoolFull Stack DeveloperJune 2019 - November 2019 (6 months)Bengaluru Area, IndiaFull stack web and Computer Science Programwith hands on experience in MERN Stack, Data Structures and Algorithmshttps://github.com/mohamedhassanmn/Twitter- @hassan_tacklerAshok LeylandGraduate Apprentice TraineeJanuary 2018 - January 2019 (1 year 1 month)Hosur Area, IndiaPositioned in Plant Engineering Department producing heavy commercialvehicle engines.  Adept in handling CNC Machine from Makino, Toyodo, AMS.Job involved attending to breakdowns with a quick turn around out time androutine preventive maintenanceEducation  Page 1 of 2   K S R College of EngineeringBachelor of Engineering (BE), Mechanical Engineering · (2013 - 2017)SRK matriculation higher secondary school11th & 12 th, Computer Science · (2011 - 2013)  Page 2 of 2"
19,"   Contact Satya Mallickspmallick@bigvisionllc.comCEO at OpenCV.orgwww.linkedin.com/in/satyamallickSan Diego(LinkedIn)graphics.ucsd.edu/~spmallick(Other) Summarywww.taaz.com (Company)Dr. Satya Mallick was recently named one of top 30 AI peopleto follow on Twitter for 2017 by IBM's AI blog.  He is the founderTop Skillsof Big Vision LLC, a San Diego, California based company thatMachine Learningspecializes in computer vision, machine learning, deep learningAlgorithmsand artificial intelligence consulting services and products. He isComputer Visionalso the principal author of a popular computer vision blog http://Languages www.learnopencv.com . HindiDr. Mallick is an accomplished computer vision and machineEnglishlearning scientist and engineer. He has worked on a variety ofCertifications problems including face processing ( detection, recognition ),object recognition using deep learning, computational photography,Computer Vision for Facesaugmented reality, document analysis, 3D reconstruction, medicalHonors-Awards image processing, and 3D cryo-electron microscopy to name a few.He has published several research papers in top notch conferencesCover of Journal of StructuralBiology and journals. Best Poster Award, UCSD ResearchReviewAt Big Vision LLC, Dr. Mallick and his team work with companiesUniversity of California, San Diegoto solve computer vision and machine learning problems thatDepartmental Fellowshiphave huge real world impact in terms of speed and accuracy ofRanked 17th, Higher SecondaryExamination, State of Odisha, India. algorithms, reduction in manual work, and identification and creationCertificate of Merit, National of intellectual property. Standard Examination in Physics( 1997 ) , India.Prior to starting Big Vision, Dr. Mallick  had co-founded and was theCTO (R&D) of Sight Commerce Inc. — a computer vision companyPublicationsthat creates vision and learning solutions for the beauty and fashionReal-Time Driver Affect Analysis andTeleviewing System industry. He oversaw research, design and implementation ofSpecularity Removal in Images and computer vision and machine learning algorithms and systems.Videos: A PDE approachAutomated cryoEM data acquisitionDr. Mallick did his Ph.D. from the University of California, Sanand analysis of 284 742 particles ofDiego. GroELIsotropy, Reciprocity and theGeneralized Bas-Relief AmbiguityACE: Automated CTF Estimation Experience  Page 1 of 3   PatentsOpenCVMethod for editing multi-channel Chief Executive OfficerimagesJanuary 2019 - Present (1 year 8 months)Methods for identifying, separatingHelping OpenCV grow!and editing reflection components inmulti-channel images and videosSystem and method for providing Big VIsion LLCand modifying a personalized faceFounder / PartnerchartFebruary 2014 - Present (6 years 7 months)System and Method for changinghair color in digital images. Big Vision LLC provides Computer Vision / Machine Learning / Deep LearningSystem and method for providing a consulting services for a wide variety of application domains that includeface chartface processing ( detection, recognition ), object recognition, hand writtentext recognition, augmented reality, and video analytics ( counting cars ,pedestrians ).  Sight Commerce Inc. / TAAZ.comFounder / CTO (R&D)August 2007 - August 2015 (8 years 1 month)Kriegman-Belhumeur Vision Technologies ( acquired by Dropbox )Research ScientistJanuary 2007 - April 2007 (4 months)University of California, San DiegoResearch AssistantDecember 2001 - September 2006 (4 years 10 months)The Scripps Research InstituteResearch Assistant2005 - 2005 (less than a year)EducationUC San DiegoPh.D., Computer Vision · (2001 - 2006)Indian Institute of Technology, KharagpurB. Tech, Electrical Engineering · (1997 - 2001)Ravenshaw CollegeHigh School  · (1995 - 1997)  Page 2 of 3   Kendriya Vidyalaya  Page 3 of 3"
20,"   Contact Aditya Kumar GhoshHouse No-3/467,468.Ruchi Khand-1,L.D.A Colony, Sharda Nagar, Bangla Software Development Engineer at Cure.FitBazar, Lucknow.226002 Bengaluru7668099020 (Mobile)masteraditya07@gmail.comSummarywww.linkedin.com/in/aditya-kumar-ghosh-787ba093 (LinkedIn) I am a graduate from MNNIT Allahabad and a computer scienceenthusiastTop SkillsJavaC++ ExperienceKubernetesCure.FitSoftware EngineerLanguagesMarch 2019 - Present (1 year 6 months)EnglishBangaloreHindiBengali (Native or Bilingual)InterviewBitMentorAugust 2019 - Present (1 year 1 month)Bengaluru, KarnatakaCodeNation1 year 9 monthsSoftware Development Engineer- 2July 2018 - March 2019 (9 months)BangaloreSoftware Development EngineerJuly 2017 - June 2018 (1 year)BangaloreMotilal Nehru National Institute of TechnologyMember Of WebteamApril 2015 - April 2017 (2 years 1 month)Allahabad Area, India Maintain the site academics.mnnit.ac.in at Dean Academics MNNT Manage the complete the college databaseBuild new portals as well as maintain the old ones such as grades entryportal, attendance portal, hostel allotment portal, transcript portal etc.  Page 1 of 2    Process the complete semester Result  for all the programmes e.g B.Tech,M.tech, Phd,etc. Worked on MYSQL, HTML, CSS, PHP, JAVASCRIPT, JQUERY, AJAX CodeNationSoftware Developer InternMay 2016 - July 2016 (3 months)Banglore Developed a platform to analyse and check the Code Quality as well as theCode Coverage for   Java projects. Implement the Filter/Rule for various standard JAVA rules for the Anti-Pattern Framework being used to analyse Projects. Used Python based Java parser and Understand tool to perform the staticcode analysis.EducationMNNITBachelor’s Degree, Computer Science and Engineering · (2013 - 2017)The Lucknow Public CollegiateCBSE 12th Boards, PCM · (2012 - 2013)The Lucknow Public CollegiateHigh School, Junior High/Intermediate/Middle School Education andTeaching · (2010 - 2011)  Page 2 of 2"
21,"   Contact Mukul VashishthGurgaon9899242501 (Mobile) CS Undergrad || Final yearmukulvashishth8@gmail.com Gurugramwww.linkedin.com/in/mukul-vashishth (LinkedIn) SummaryI am an Undergrad in CS currently in my final year of B.Tech and ITop Skillshave a huge interest in problem solving and programming .  I alsoC (Programming Language)have a keen interest in the field of cyber security  and i occasionallyC++participate in CTF's that are held online .Problem SolvingI have a basic knowledge of webLanguagesdevelopment( HTML,CSS,Javascript) . I love spending time to solveHindi (Native or Bilingual)problems on various competetive programming platforms . ExploringEnglish (Professional Working)different domains of my interest.CertificationsTech/Languages:Cloud Computing Basics (Cloud 101-Proficient in C/C++-Working Knowledge of pythonEducationNoida Institute of Engineering & TechnologyBachelor of Technology, Computer Science · (2017 - 2021)  Page 1 of 1"
